,number,value,datetime_start,datetime_complete,duration,params_batch_size,params_decay,params_dropout,params_lr,params_transform,state
131,131,73.92,2025-10-24 02:51:30.062424,2025-10-24 02:52:26.455773,0 days 00:00:56.393349,32,1e-07,0.0016212096590721378,0.0005335241251520772,easy_transform,COMPLETE
132,132,59.02,2025-10-24 02:52:26.456979,2025-10-24 02:53:21.325155,0 days 00:00:54.868176,32,1e-07,0.03710948453823082,0.0005308359329381953,easy_transform,COMPLETE
133,133,69.24,2025-10-24 02:53:21.326471,2025-10-24 02:54:16.256831,0 days 00:00:54.930360,32,1e-07,0.01612138622607668,0.0007145527674118626,easy_transform,COMPLETE
134,134,74.54,2025-10-24 02:54:16.257941,2025-10-24 02:55:11.184099,0 days 00:00:54.926158,32,1e-07,0.0013801218493118598,0.000715912393104175,easy_transform,COMPLETE
135,135,20.06,2025-10-24 02:55:11.185093,2025-10-24 02:56:05.929617,0 days 00:00:54.744524,32,0.01,0.002392337285259726,0.0008821185125862124,easy_transform,COMPLETE
136,136,47.4,2025-10-24 02:56:05.930616,2025-10-24 02:56:48.419082,0 days 00:00:42.488466,256,1e-07,0.054801480626563696,0.0007076827768684901,easy_transform,COMPLETE
137,137,58.0,2025-10-24 02:56:48.420082,2025-10-24 02:57:43.734388,0 days 00:00:55.314306,32,1e-05,0.045868429858097935,0.0006467023780062142,easy_transform,COMPLETE
138,138,48.58,2025-10-24 02:57:43.735386,2025-10-24 02:58:38.520148,0 days 00:00:54.784762,32,1e-07,0.08877436507170317,0.0008234985005322825,easy_transform,COMPLETE
139,139,43.42,2025-10-24 02:58:38.521537,2025-10-24 02:59:18.552476,0 days 00:00:40.030939,512,0.0,0.03269922732853472,0.0007338596079795454,easy_transform,COMPLETE
140,140,74.06,2025-10-24 02:59:18.553476,2025-10-24 03:00:13.282984,0 days 00:00:54.729508,32,1e-07,0.0014318119732998989,0.0005896324581964468,easy_transform,COMPLETE
141,141,66.1,2025-10-24 03:00:13.284107,2025-10-24 03:01:07.985004,0 days 00:00:54.700897,32,1e-07,0.0179423353846297,0.00047610594493885193,easy_transform,COMPLETE
142,142,76.12,2025-10-24 03:01:07.986002,2025-10-24 03:02:02.399717,0 days 00:00:54.413715,32,1e-07,0.00014695927328848743,0.0006080328121045144,easy_transform,COMPLETE
143,143,74.22,2025-10-24 03:02:02.400717,2025-10-24 03:02:57.007806,0 days 00:00:54.607089,32,1e-07,0.001130849290250121,0.0006229534988317205,easy_transform,COMPLETE
144,144,76.42,2025-10-24 03:02:57.008806,2025-10-24 03:03:51.587072,0 days 00:00:54.578266,32,1e-07,0.00021327352753609309,0.0006209256802738554,easy_transform,COMPLETE
145,145,61.66,2025-10-24 03:03:51.588071,2025-10-24 03:04:51.130053,0 days 00:00:59.541982,32,1e-07,0.03620247379625441,0.0006319016801488215,easy_transform,COMPLETE
146,146,75.52,2025-10-24 03:04:51.131051,2025-10-24 03:05:45.718713,0 days 00:00:54.587662,32,1e-08,0.0005121765504927264,0.000748956457119115,easy_transform,COMPLETE
147,147,50.16,2025-10-24 03:05:45.719713,2025-10-24 03:06:40.685461,0 days 00:00:54.965748,32,1e-08,0.06834176123108585,0.0009070196797819983,easy_transform,COMPLETE
148,148,50.54,2025-10-24 03:06:40.686460,2025-10-24 03:07:23.757454,0 days 00:00:43.070994,128,1e-08,0.03714875753945976,0.0007418319671650286,easy_transform,COMPLETE
149,149,65.48,2025-10-24 03:07:23.758464,2025-10-24 03:08:19.262076,0 days 00:00:55.503612,32,1e-08,0.023476457402053445,0.0008502172604601249,easy_transform,COMPLETE
