,number,value,datetime_start,datetime_complete,duration,params_batch_size,params_decay,params_dropout,params_hidden_size,params_lr,params_transform,state
128,128,99.42,2025-10-24 00:43:03.758431,2025-10-24 00:43:37.405540,0 days 00:00:33.647109,512,0.0,0.0002472073157506437,256,0.0006068576921444754,easy_transform,COMPLETE
129,129,96.44,2025-10-24 00:43:37.406540,2025-10-24 00:44:20.076599,0 days 00:00:42.670059,128,0.0,0.008179842027138954,256,0.0006219115792384679,easy_transform,COMPLETE
130,130,48.98,2025-10-24 00:44:20.077599,2025-10-24 00:44:50.585075,0 days 00:00:30.507476,512,0.0,0.011972347667602785,64,0.0005920149098918146,easy_transform,COMPLETE
131,131,98.48,2025-10-24 00:44:50.586074,2025-10-24 00:45:24.482281,0 days 00:00:33.896207,512,0.0,0.07979912786494198,256,0.0009816589836188017,easy_transform,COMPLETE
132,132,98.7,2025-10-24 00:45:24.482281,2025-10-24 00:45:57.876143,0 days 00:00:33.393862,512,0.0,0.034199136850791935,256,0.0007437807211389712,easy_transform,COMPLETE
133,133,99.58,2025-10-24 00:45:57.877144,2025-10-24 00:46:31.531950,0 days 00:00:33.654806,512,0.0,0.0023997036078701045,256,0.0008137033306670498,easy_transform,COMPLETE
134,134,99.82,2025-10-24 00:46:31.532949,2025-10-24 00:47:04.952142,0 days 00:00:33.419193,512,0.0,0.00339332800326499,256,0.0008115506367631421,easy_transform,COMPLETE
135,135,99.1,2025-10-24 00:47:04.953141,2025-10-24 00:47:38.388675,0 days 00:00:33.435534,512,0.0,0.001631153165684178,256,0.0005206153857936082,easy_transform,COMPLETE
136,136,33.42,2025-10-24 00:47:38.389674,2025-10-24 00:48:11.035568,0 days 00:00:32.645894,256,0.0,0.016985640863208362,32,0.0008249950678096866,easy_transform,COMPLETE
137,137,99.62,2025-10-24 00:48:11.036568,2025-10-24 00:48:44.509697,0 days 00:00:33.473129,512,0.0,7.852798626034607e-05,256,0.0007151539597396442,easy_transform,COMPLETE
138,138,99.3,2025-10-24 00:48:44.510694,2025-10-24 00:49:18.222963,0 days 00:00:33.712269,512,0.0,0.006803082860419064,256,0.0006240196592884379,easy_transform,COMPLETE
139,139,30.08,2025-10-24 00:49:18.223952,2025-10-24 00:50:04.093220,0 days 00:00:45.869268,512,0.0,0.009481531347409318,256,0.0006198336191398675,crop_transform,COMPLETE
140,140,99.62,2025-10-24 00:50:04.094388,2025-10-24 00:50:37.810971,0 days 00:00:33.716583,512,0.0,0.0007546068881615726,256,0.000708272896311695,easy_transform,COMPLETE
141,141,99.72,2025-10-24 00:50:37.811971,2025-10-24 00:51:11.264155,0 days 00:00:33.452184,512,0.0,0.001384596026082799,256,0.0007041031612803592,easy_transform,COMPLETE
142,142,99.66,2025-10-24 00:51:11.265168,2025-10-24 00:51:44.887554,0 days 00:00:33.622386,512,0.0,8.303650958430692e-06,256,0.0007043035329622675,easy_transform,COMPLETE
143,143,99.14,2025-10-24 00:51:44.888552,2025-10-24 00:52:18.340181,0 days 00:00:33.451629,512,0.0,0.037387738332108136,256,0.0007018327232147293,easy_transform,COMPLETE
144,144,99.14,2025-10-24 00:52:18.341184,2025-10-24 00:52:51.856016,0 days 00:00:33.514832,512,0.0,0.0010002317469999704,256,0.0005460629272700965,easy_transform,COMPLETE
145,145,99.76,2025-10-24 00:52:51.856016,2025-10-24 00:53:25.571093,0 days 00:00:33.715077,512,0.0,0.000982899844038617,256,0.000717486662305128,easy_transform,COMPLETE
146,146,99.06,2025-10-24 00:53:25.572093,2025-10-24 00:53:59.736723,0 days 00:00:34.164630,512,0.0,0.03479575783218924,256,0.0007173620108189091,easy_transform,COMPLETE
147,147,98.32,2025-10-24 00:53:59.737723,2025-10-24 00:54:33.134090,0 days 00:00:33.396367,512,0.0,0.07750708548241725,256,0.000775016587685414,easy_transform,COMPLETE
148,148,95.38,2025-10-24 00:54:33.135221,2025-10-24 00:55:05.140013,0 days 00:00:32.004792,1024,0.0,0.03817907382365322,256,0.0006890782910719774,easy_transform,COMPLETE
149,149,71.7,2025-10-24 00:55:05.141013,2025-10-24 00:55:39.506377,0 days 00:00:34.365364,512,0.01,0.0005429832071107768,256,9.493237957233243e-05,easy_transform,COMPLETE
